{
  "$schema": "https://json-schema.org/draft/2020-12/schema",
  "$id": "https://financial-intelligence.local/schemas/dashboard.schema.json",
  "title": "Dashboard",
  "type": "object",
  "additionalProperties": false,
  "required": ["schemaVersion", "id", "name", "filters", "widgets", "createdAt", "updatedAt"],
  "properties": {
    "schemaVersion": { "const": "1.0.0" },
    "id": { "$ref": "#/$defs/uuid" },
    "name": { "type": "string", "minLength": 1, "maxLength": 120 },
    "filters": { "$ref": "#/$defs/filters" },
    "widgets": {
      "type": "array",
      "minItems": 1,
      "maxItems": 50,
      "items": { "$ref": "#/$defs/widget" }
    },
    "createdAt": { "$ref": "#/$defs/dateTime" },
    "updatedAt": { "$ref": "#/$defs/dateTime" }
  },
  "$defs": {
    "uuid": { "type": "string", "format": "uuid" },
    "date": { "type": "string", "format": "date" },
    "dateTime": { "type": "string", "format": "date-time" },
    "filters": {
      "type": "object",
      "additionalProperties": false,
      "properties": {
        "dateFrom": { "$ref": "#/$defs/date" },
        "dateTo": { "$ref": "#/$defs/date" },
        "accountIds": { "type": "array", "uniqueItems": true, "items": { "$ref": "#/$defs/uuid" } },
        "categoryIds": { "type": "array", "uniqueItems": true, "items": { "$ref": "#/$defs/uuid" } },
        "merchantIds": { "type": "array", "uniqueItems": true, "items": { "$ref": "#/$defs/uuid" } },
        "tags": { "type": "array", "uniqueItems": true, "items": { "type": "string", "minLength": 1, "maxLength": 60 } },
        "currency": { "type": "string", "pattern": "^[A-Z]{3}$" },
        "excludeTransfers": { "type": "boolean", "default": true }
      }
    },
    "widget": {
      "type": "object",
      "additionalProperties": false,
      "required": ["id", "type", "title", "query", "layout", "showTableAlternative"],
      "properties": {
        "id": { "$ref": "#/$defs/uuid" },
        "type": { "enum": ["metric", "timeSeries", "categoryBreakdown", "merchantRanking", "moneyFlow", "calendarHeatmap", "recurringList", "table"] },
        "title": { "type": "string", "minLength": 1, "maxLength": 120 },
        "query": {
          "type": "object",
          "additionalProperties": false,
          "required": ["metric"],
          "properties": {
            "metric": { "enum": ["income", "spending", "netCashFlow", "transactionCount", "savingsRate"] },
            "dimension": { "enum": ["month", "category", "merchant", "account", "day"] },
            "limit": { "type": "integer", "minimum": 1, "maximum": 1000 },
            "sort": { "enum": ["valueAsc", "valueDesc", "labelAsc", "labelDesc", "dateAsc", "dateDesc"] }
          }
        },
        "layout": {
          "type": "object",
          "additionalProperties": false,
          "required": ["x", "y", "width", "height"],
          "properties": {
            "x": { "type": "integer", "minimum": 0 },
            "y": { "type": "integer", "minimum": 0 },
            "width": { "type": "integer", "minimum": 1, "maximum": 12 },
            "height": { "type": "integer", "minimum": 1, "maximum": 20 }
          }
        },
        "showTableAlternative": { "const": true }
      }
    }
  }
}
